{
  "$schema": "https://json-schema.org/draft/2020-12/schema",
  "$id": "https://github.com/reoptimus/financyou/schemas/placement_catalog-0.1.json",
  "title": "Catalogue des placements FinancYou (GSE+)",
  "description": "Les placements accessibles à un foyer : un support construit à partir du GSE, logé dans une enveloppe du régime fiscal, avec ses frais. Pas de fiscalité ici (voir tax_regimes/) ; pas d'hypothèse de marché générale (voir market_assumptions/). Voir docs/adr/0002-le-placement-est-l-unite-d-optimisation.md.",
  "type": "object",
  "required": ["schema_version", "id", "country", "tax_regime", "status", "sources", "known_gaps", "placements"],
  "additionalProperties": false,

  "$defs": {
    "rate_or_unknown": {
      "type": ["number", "null"],
      "minimum": 0,
      "maximum": 1,
      "description": "Fraction (0,0066 pour 0,66 %). null : valeur pas encore sourcée, refusée dans un catalogue validé."
    },
    "gse_series": {
      "enum": ["stock_return", "bond_return", "real_estate_return", "interest_rate", "inflation"],
      "description": "Colonne des scénarios produits par modules/scenario_generator.py."
    }
  },

  "properties": {
    "$schema": { "type": "string" },
    "schema_version": { "type": "string", "pattern": "^\\d+\\.\\d+$" },
    "id": { "type": "string", "pattern": "^[a-z]{2}-\\d{4}$" },
    "country": { "type": "string", "pattern": "^[A-Z]{2}$" },
    "tax_regime": {
      "type": "string",
      "description": "Identifiant du régime fiscal dont les enveloppes sont référencées, par exemple fr-2026."
    },
    "status": { "enum": ["draft", "validated"] },
    "validation": {
      "type": "object",
      "additionalProperties": false,
      "properties": {
        "validated_by": { "type": ["string", "null"] },
        "validated_on": { "type": ["string", "null"], "format": "date" }
      }
    },
    "sources": {
      "type": "array",
      "items": {
        "type": "object",
        "required": ["label"],
        "additionalProperties": false,
        "properties": {
          "label": { "type": "string" },
          "url": { "type": "string" },
          "consulted_on": { "type": "string", "format": "date" },
          "covers": { "type": "array", "items": { "type": "string" } }
        }
      }
    },
    "known_gaps": { "type": "array", "items": { "type": "string" } },

    "placements": {
      "type": "array",
      "minItems": 1,
      "items": {
        "type": "object",
        "required": ["id", "label", "wrapper", "asset_class", "support", "fees"],
        "additionalProperties": false,
        "properties": {
          "id": { "type": "string", "pattern": "^[a-z][a-z0-9_]*$" },
          "label": { "type": "string" },
          "wrapper": {
            "type": "string",
            "description": "Identifiant d'une enveloppe du régime fiscal (wrappers[].id)."
          },
          "asset_class": {
            "type": "string",
            "description": "Classe d'actifs, à prendre parmi les eligible_assets de l'enveloppe."
          },
          "support": {
            "oneOf": [
              {
                "type": "object",
                "description": "Le rendement d'une série du GSE, tel quel.",
                "required": ["model", "series"],
                "additionalProperties": false,
                "properties": {
                  "model": { "const": "gse_series" },
                  "series": { "$ref": "#/$defs/gse_series" },
                  "income": {
                    "enum": ["distributing", "accumulating"],
                    "description": "Fonds de distribution (dividendes ou coupons versés, imposés chaque année dans une enveloppe imposée au fil de l'eau) ou de capitalisation (revenus réinvestis, impôt à la seule sortie, sur la plus-value). Absent : distribution."
                  }
                }
              },
              {
                "type": "object",
                "description": "Fonds en euros : capital garanti, rendement servi tiré du rendement obligataire du GSE.",
                "required": ["model", "reference_series", "pass_through", "floor_rate"],
                "additionalProperties": false,
                "properties": {
                  "model": { "const": "euro_fund" },
                  "reference_series": { "$ref": "#/$defs/gse_series" },
                  "pass_through": {
                    "$ref": "#/$defs/rate_or_unknown",
                    "description": "Part du rendement de référence servie avant frais de gestion."
                  },
                  "floor_rate": {
                    "$ref": "#/$defs/rate_or_unknown",
                    "description": "Plancher du rendement servi avant frais de gestion : les frais s'appliquent ensuite, comme pour un capital garanti hors frais."
                  }
                }
              },
              {
                "type": "object",
                "description": "Fonds en euros lissé : le rendement servi suit le rendement comptable d'un portefeuille obligataire dont 1/renewal_years est réinvesti chaque année au taux de référence du GSE, y(t) = y(t-1) + (r(t) - y(t-1)) / renewal_years ; puis max(pass_through × y(t), floor_rate) et frais de gestion.",
                "required": ["model", "reference_series", "renewal_years", "initial_yield", "pass_through", "floor_rate"],
                "additionalProperties": false,
                "properties": {
                  "model": { "const": "euro_fund_smoothed" },
                  "reference_series": {
                    "$ref": "#/$defs/gse_series",
                    "description": "Taux auquel l'assureur place les sommes réinvesties chaque année."
                  },
                  "renewal_years": {
                    "type": ["number", "null"],
                    "minimum": 1,
                    "description": "Durée de renouvellement du portefeuille, en années. null : valeur pas encore sourcée, refusée dans un catalogue validé."
                  },
                  "initial_yield": {
                    "$ref": "#/$defs/rate_or_unknown",
                    "description": "Rendement comptable du portefeuille à la date de départ, avant redistribution."
                  },
                  "pass_through": {
                    "$ref": "#/$defs/rate_or_unknown",
                    "description": "Part du rendement du portefeuille servie avant frais de gestion."
                  },
                  "floor_rate": {
                    "$ref": "#/$defs/rate_or_unknown",
                    "description": "Plancher du rendement servi avant frais de gestion."
                  }
                }
              },
              {
                "type": "object",
                "description": "Fonds en euros adossé à l'actif général de l'assureur : rendement de l'actif a(t) = somme pondérée des actifs ; réserve disponible B(t) = P(t-1) + pass_through × a(t), avec P(-1) = initial_rate ; taux servi max(B(t) / release_divisor, floor_rate) ; provision restante P(t) = max(B(t) - servi, 0) ; puis frais de gestion et marge de l'assureur.",
                "required": ["model", "assets", "pass_through", "profit_sharing_reserve", "floor_rate", "insurer_margin"],
                "additionalProperties": false,
                "properties": {
                  "model": { "const": "euro_fund_general_account" },
                  "assets": {
                    "type": "array",
                    "minItems": 1,
                    "description": "Composition de l'actif général ; les poids font 1.",
                    "items": {
                      "oneOf": [
                        {
                          "type": "object",
                          "description": "Actif suivi en valeur de marché : une série du GSE.",
                          "required": ["kind", "weight", "series"],
                          "additionalProperties": false,
                          "properties": {
                            "kind": { "const": "gse_series" },
                            "weight": { "$ref": "#/$defs/rate_or_unknown" },
                            "series": { "$ref": "#/$defs/gse_series" }
                          }
                        },
                        {
                          "type": "object",
                          "description": "Obligations en valeur comptable : portefeuille dont 1/renewal_years est réinvesti chaque année au taux de référence, y(t) = y(t-1) + (r(t) - y(t-1)) / renewal_years.",
                          "required": ["kind", "weight", "reference_series", "renewal_years", "initial_yield"],
                          "additionalProperties": false,
                          "properties": {
                            "kind": { "const": "book_bonds" },
                            "weight": { "$ref": "#/$defs/rate_or_unknown" },
                            "reference_series": { "$ref": "#/$defs/gse_series" },
                            "renewal_years": {
                              "type": ["number", "null"],
                              "minimum": 1,
                              "description": "Durée de renouvellement du portefeuille, en années. null : valeur pas encore sourcée, refusée dans un catalogue validé."
                            },
                            "initial_yield": {
                              "$ref": "#/$defs/rate_or_unknown",
                              "description": "Rendement comptable du portefeuille à la date de départ."
                            }
                          }
                        }
                      ]
                    }
                  },
                  "pass_through": {
                    "$ref": "#/$defs/rate_or_unknown",
                    "description": "Part du rendement de l'actif versée aux assurés, directement ou via la provision."
                  },
                  "profit_sharing_reserve": {
                    "type": "object",
                    "description": "Provision pour participation aux bénéfices (PPB), en fraction de l'encours.",
                    "required": ["initial_rate", "release_divisor"],
                    "additionalProperties": false,
                    "properties": {
                      "initial_rate": {
                        "$ref": "#/$defs/rate_or_unknown",
                        "description": "Stock de provision à la date de départ, en fraction de l'encours."
                      },
                      "release_divisor": {
                        "type": ["number", "null"],
                        "minimum": 1,
                        "description": "Chaque année, 1/release_divisor de la réserve disponible est servi. 1 : pas de lissage. null : valeur pas encore sourcée."
                      }
                    }
                  },
                  "floor_rate": {
                    "$ref": "#/$defs/rate_or_unknown",
                    "description": "Plancher du rendement servi avant frais de gestion."
                  },
                  "insurer_margin": {
                    "$ref": "#/$defs/rate_or_unknown",
                    "description": "Marge de l'assureur, prélevée chaque année sur l'encours comme des frais. 0 si le calage ne l'exige pas."
                  }
                }
              },
              {
                "type": "object",
                "description": "Taux réglementé : max(plancher, arrondi(poids_taux × taux court + poids_inflation × inflation)).",
                "required": ["model", "short_rate_weight", "inflation_weight", "rounding_step", "floor_rate"],
                "additionalProperties": false,
                "properties": {
                  "model": { "const": "regulated_rate" },
                  "short_rate_weight": { "type": "number", "minimum": 0, "maximum": 1 },
                  "inflation_weight": { "type": "number", "minimum": 0, "maximum": 1 },
                  "rounding_step": { "type": "number", "exclusiveMinimum": 0 },
                  "floor_rate": { "type": "number", "minimum": 0 }
                }
              }
            ]
          },
          "fees": {
            "type": "object",
            "required": ["entry_rate", "annual_rate"],
            "additionalProperties": false,
            "properties": {
              "entry_rate": { "$ref": "#/$defs/rate_or_unknown" },
              "annual_rate": {
                "$ref": "#/$defs/rate_or_unknown",
                "description": "Frais prélevés chaque année sur l'encours."
              }
            }
          }
        }
      }
    }
  }
}
