{
  "$schema": "./schema.json",
  "schema_version": "0.1",
  "id": "fr-2026",
  "country": "FR",
  "tax_regime": "fr-2026",
  "status": "validated",
  "validation": {
    "validated_by": "Sébastien Gallet",
    "validated_on": "2026-10-10"
  },
  "sources": [
    {
      "label": "CCSF, Observatoire des produits d'épargne financière (OPEF), rapport annuel 2026 (données 2025), p. 4 : frais de gestion annuels moyens de l'assurance-vie « 0,67 % pour les fonds en euros, à 0,80 % pour les UC en gestion libre ». p. 27 : le capital investi en fonds euros « est garanti (hors frais de versement et de gestion) ».",
      "url": "https://www.banque-france.fr/system/files/2026-06/OPEF2026.pdf",
      "consulted_on": "2026-10-10",
      "covers": [
        "av_fonds_euros.fees.annual_rate",
        "av_uc_actions.fees.annual_rate",
        "av_fonds_euros.support.floor_rate"
      ]
    },
    {
      "label": "CCSF, OPEF, rapport 2026, cité par MoneyVox le 25 juin 2026 : frais sur versement moyens de l'assurance-vie en 2025, 0,55 % sur les fonds en euros et 0,57 % sur les unités de compte (données ACPR). Source secondaire : la section 2.3 du rapport n'a pas pu être lue.",
      "url": "https://www.moneyvox.fr/assurance-vie/actualites/109415/votre-contrat-est-il-plus-gourmand-en-frais-que-la-moyenne",
      "consulted_on": "2026-10-10",
      "covers": [
        "av_fonds_euros.fees.entry_rate",
        "av_uc_actions.fees.entry_rate"
      ]
    },
    {
      "label": "CCSF, OPEF, rapport 2026, cité par Toutsurmesfinances le 25 juin 2026 : coût du service de tenue de compte, 0,15 % par an pour le compte-titres et 0,07 % pour le PEA en 2025 (panel de 24 établissements, investissement de 10 000 €). Source secondaire.",
      "url": "https://www.toutsurmesfinances.com/actualites/?p=1047",
      "consulted_on": "2026-10-10",
      "covers": [
        "cto_actions.fees.annual_rate",
        "cto_obligations.fees.annual_rate",
        "pea_actions.fees.annual_rate"
      ]
    },
    {
      "label": "AMF, La Lettre de l'Observatoire de l'épargne n° 65, avril 2026 : les ETF répliquant des indices d'actions affichent « des frais annuels moyens en légère baisse à 0,33 % (0,36 % en 2024) ».",
      "url": "https://www.amf-france.org/sites/institutionnel/files/private/2026-04/loe-65_1.pdf",
      "consulted_on": "2026-10-10",
      "covers": [
        "cto_actions.fees.annual_rate",
        "cto_obligations.fees.annual_rate",
        "pea_actions.fees.annual_rate",
        "av_uc_actions.fees.annual_rate"
      ]
    },
    {
      "label": "Décret n° 2020-95 du 5 février 2020 (loi PACTE), plafonds des frais du PEA : frais de transaction de 0,5 % pour un ordre passé en ligne. Cité par Finary ; texte officiel non relu.",
      "url": "https://www.legifrance.gouv.fr/jorf/id/JORFTEXT000041539976",
      "consulted_on": "2026-10-10",
      "covers": [
        "pea_actions.fees.entry_rate",
        "cto_actions.fees.entry_rate",
        "cto_obligations.fees.entry_rate"
      ]
    },
    {
      "label": "Code des assurances, art. L132-29 et A132-16 et suivants : l'assureur redistribue au moins 85 % de ses bénéfices financiers et 90 % de ses bénéfices techniques. Cité par Nalo ; texte officiel non relu.",
      "url": "https://blog.nalo.fr/participation-benefices-assurance-vie/",
      "consulted_on": "2026-10-10",
      "covers": [
        "av_fonds_euros.support.pass_through"
      ]
    },
    {
      "label": "France Assureurs, Les placements de l'assurance en 2024, p. 3 : placements totaux de 2 619,0 Md€ après transparence des OPC, dont 597,9 Md€ en UC ; répartition 24,5 % actions, 23,6 % obligations souveraines, 34,0 % obligations d'entreprises, 6,4 % immobilier, 3,2 % prêts, 3,9 % trésorerie et dépôts, 4,5 % autres (unités de compte comprises).",
      "url": "https://www.franceassureurs.fr/wp-content/uploads/les-placements-de-lassurance-2024-vf-1.pdf",
      "consulted_on": "2026-10-10",
      "covers": [
        "av_fonds_euros.support.assets"
      ]
    },
    {
      "label": "ACPR, Analyses et synthèses n° 175, août 2025, revalorisation des contrats d'assurance-vie en 2024. p. 2 et 15 : provision pour participation aux bénéfices de 4,3 % des provisions des contrats individuels fin 2024 ; taux servi moyen de 2,63 % en 2024, net de frais de gestion. p. 19 : actifs en représentation des UC à 31 % en fonds actions, 20 % en fonds à allocation d'actifs, 12 % en fonds obligataires, 6 % en fonds monétaires, 5 % en fonds immobiliers, 10 % en produits structurés actions.",
      "url": "https://acpr.banque-france.fr/system/files/2025-08/20250804_AS175_Revalorisation_contrats_assurance_vie_2024.pdf",
      "consulted_on": "2026-10-10",
      "covers": [
        "av_fonds_euros.support.profit_sharing_reserve",
        "av_fonds_euros.support.assets",
        "av_fonds_euros.support.assets[0].initial_yield"
      ]
    },
    {
      "label": "Banque de France, Bulletin n° 260/2, septembre 2025, placements des assureurs, p. 10 : 20 % du portefeuille obligataire arrive à échéance à moins de 2 ans et 47 % à moins de 6 ans.",
      "url": "https://www.banque-france.fr/system/files/2025-09/BDF260_2_placements_assurances.pdf",
      "consulted_on": "2026-10-10",
      "covers": [
        "av_fonds_euros.support.assets[0].renewal_years"
      ]
    },
    {
      "label": "Arrêté du 27 janvier 2021 relatif aux taux d'intérêt des produits d'épargne réglementée, article 1er : taux du Livret A = le plus élevé entre la moyenne arithmétique de l'€STR et de l'inflation hors tabac (moyennes semestrielles), arrondie au dixième de point, et 0,5 %.",
      "url": "https://legifrance.gouv.fr/jorf/id/JORFTEXT000043114027",
      "consulted_on": "2026-10-09",
      "covers": [
        "livret_a.support"
      ]
    },
    {
      "label": "Service-public.gouv.fr, fiche F2365 : « Les opérations effectuées sur le livret A (ouverture, dépôt, retrait et clôture) sont gratuites. »",
      "url": "https://www.service-public.gouv.fr/particuliers/vosdroits/F2365",
      "consulted_on": "2026-10-09",
      "covers": [
        "livret_a.fees"
      ]
    },
    {
      "label": "La Française Real Estate Managers, Document d'informations clés de la SCPI Epargne Fonciere (ISIN FR0014005QK8), 05/12/2025 : coûts d'entrée 7,50 % du montant investi, pas de coût de sortie, frais de gestion et autres frais administratifs et d'exploitation 1,53 % de la valeur par an, coûts de transaction 0,40 % par an, hors frais du contrat d'assurance-vie. Epargne Fonciere sert de SCPI de référence : l'une des plus grandes du marché, proposée en assurance-vie.",
      "url": "https://access.fortunyconseil.fr/api/v1/SCPI/files/documentinformationscles2026_93bb22200a6711f1b0bcf74909daa338.pdf",
      "consulted_on": "2026-10-24",
      "covers": [
        "av_scpi.fees.entry_rate",
        "av_scpi.fees.annual_rate",
        "scpi_direct.fees.entry_rate",
        "scpi_direct.fees.annual_rate"
      ]
    }
  ],
  "known_gaps": [
    "Valeurs proposées par un agent le 2026-10-10 avec leurs sources, validées par Sébastien Gallet le 2026-10-10 (choix « Valider tel quel » sur la PR #32). Fonds en euros adossé à l'actif général : poids, lissage et paramètres obligataires validés par Sébastien Gallet le 2026-10-10 (choix dans le fil du projet).",
    "Toutes les valeurs de frais sont des moyennes de marché : un contrat ou un courtier donné peut être très au-dessus (frais d'entrée de plusieurs pour cent en agence) ou au-dessous (0 % en ligne).",
    "Frais d'entrée du compte-titres et du PEA : le plafond légal du courtage en ligne sur PEA (0,5 %) sert de borne prudente ; aucune moyenne de courtage n'a été trouvée. Pour le compte-titres, sans plafond légal, la même valeur est reprise par défaut.",
    "Frais annuels du compte-titres et du PEA : somme des frais moyens d'un ETF actions (AMF) et de la tenue de compte moyenne (OPEF). Le support est supposé indiciel ; un fonds actif coûte en moyenne 1,37 % par an (AMF, même lettre).",
    "Obligations en compte-titres : fonds de capitalisation (income = accumulating), choix de Sébastien Gallet le 2026-10-25. Les coupons sont réinvestis et l'impôt est payé à la sortie, sur la plus-value. Un fonds de distribution aurait ses coupons imposés chaque année.",
    "Obligations en compte-titres : faute de moyenne publiée pour les ETF obligataires, les frais d'un ETF actions sont repris, ce qui est probablement prudent.",
    "Unités de compte : frais du contrat (0,80 %, gestion libre) plus frais d'un ETF actions (0,33 %). Les supports en UC coûtent en moyenne 1,60 % par an selon l'OPEF (source secondaire), car la plupart sont des fonds actifs.",
    "Fonds en euros : pass_through = 0,85, minimum légal de redistribution des bénéfices financiers, appliqué au rendement de l'actif général modélisé. Le code R d'origine retenait 0,9.",
    "Fonds en euros, poids de l'actif général (72 % obligations et prêts en valeur comptable, 17 % actions, 7 % immobilier, 4 % monétaire) : aucune répartition hors UC n'est publiée. Les poids sont déduits des placements totaux de France Assureurs, moins les UC reconstituées d'après l'ACPR (n° 175, p. 19), en supposant les fonds à allocation d'actifs à moitié actions, moitié obligations, et en rangeant les 16 % d'UC non ventilés en monétaire et autres. Le périmètre inclut les assureurs non-vie.",
    "Fonds en euros : actions et immobilier comptés en valeur de marché, alors que seules les plus-values réalisées entrent dans le résultat d'un assureur ; la réserve de capitalisation et la provision pour risque d'exigibilité ne sont pas représentées. Le taux servi varie donc davantage qu'en réalité (0,86 point par an en moyenne sur les scénarios).",